{
 "scene": "highway_brazil",
 "coords": "site_m",
 "left_handed": true,
 "lanes": [
  {
   "id": "NB",
   "width_m": 12.0,
   "speed_limit_kmh": 60,
   "left_line": "none",
   "right_line": "none",
   "lane_type": "driving",
   "junction": false,
   "centreline": [
    [
     20.293,
     28.771
    ],
    [
     19.876,
     18.165
    ],
    [
     20.307,
     7.559
    ],
    [
     21.552,
     -3.047
    ],
    [
     22.103,
     -13.654
    ],
    [
     21.926,
     -24.26
    ],
    [
     21.778,
     -34.866
    ],
    [
     22.499,
     -45.472
    ],
    [
     23.779,
     -56.078
    ],
    [
     25.433,
     -66.684
    ],
    [
     26.487,
     -77.29
    ],
    [
     27.929,
     -87.896
    ],
    [
     29.068,
     -98.502
    ],
    [
     30.065,
     -109.108
    ],
    [
     30.97,
     -119.714
    ],
    [
     31.945,
     -130.32
    ],
    [
     33.063,
     -140.926
    ],
    [
     33.756,
     -151.532
    ],
    [
     34.293,
     -162.138
    ],
    [
     34.724,
     -172.744
    ],
    [
     35.608,
     -183.351
    ],
    [
     36.853,
     -193.957
    ],
    [
     39.165,
     -204.563
    ],
    [
     41.491,
     -215.169
    ],
    [
     43.662,
     -225.775
    ],
    [
     44.927,
     -236.381
    ],
    [
     46.257,
     -246.987
    ]
   ]
  },
  {
   "id": "SB",
   "width_m": 10.5,
   "speed_limit_kmh": 60,
   "left_line": "none",
   "right_line": "none",
   "lane_type": "driving",
   "junction": false,
   "centreline": [
    [
     0.749,
     -2.538
    ],
    [
     1.895,
     1.704
    ],
    [
     2.871,
     5.946
    ],
    [
     3.712,
     10.189
    ],
    [
     4.568,
     14.431
    ],
    [
     5.522,
     18.674
    ],
    [
     6.547,
     22.916
    ]
   ]
  }
 ],
 "zones": [],
 "stop_lines": []
}